TransactionID,CustomerID,CustomerName,ProductID,ProductName,ProductCategory,PurchaseQuantity,PurchasePrice,PurchaseDate,Country,ReviewID,ReviewText,ReviewDate,ReviewSentiment,SentimentClass,Revenue,Month,PriceSegment,SentimentBucket,TotalSpend,Frequency,Recency,RFM_Score,Segment,Cohort,TxMonth,Index,Subscription
416,614,Richard Turner,211,Laptop,Electronics,3,170.87,2023-10-13,Serbia,416,This is hands down the best purchase I've made this year.,1/28/2024,0.422222222,Positive,512.61,10,Budget,M-Pos,1902.4099999999999,2,224,7,Potential,2023-10,2023-10,0,0
417,548,Rodney Johnson,220,Washing Machine,Home Appliances,2,23.94,2024-01-19,Cyprus,417,"The customer service was fantastic, and the product arrived on time.",6/4/2024,0.4,Positive,47.88,1,Budget,M-Pos,1367.82,3,51,10,Champions,2023-09,2024-01,4,0
418,239,Rebecca Atkinson,237,Washing Machine,Home Appliances,5,677.66,2024-02-27,Cambodia,418,I regret buying this. The quality is terrible and it stopped working within a week.,12/29/2023,-1.0,Negative,3388.2999999999997,2,Premium,S-Neg,3388.2999999999997,1,119,7,Potential,2024-02,2024-02,0,0
419,405,Suzanne Norton,293,Headphones,Electronics,5,857.59,2024-03-03,Holy See (Vatican City State),419,The quality is outstanding. I'm extremely impressed.,5/13/2024,0.75,Positive,4287.95,3,Luxury,S-Pos,4507.61,3,114,11,Champions,2023-11,2024-03,4,0
420,111,Kristen Martinez,200,Coffee Maker,Home Appliances,5,334.65,2024-02-03,Nauru,420,I am extremely satisfied with my purchase. Worth every penny!,10/21/2023,0.4375,Positive,1673.25,2,Mid,M-Pos,1673.25,1,143,6,Potential,2024-02,2024-02,0,1
421,503,Theresa Torres,295,Refrigerator,Home Appliances,2,981.87,2024-04-08,United Kingdom,421,I've never been this satisfied with a purchase before.,2/10/2024,0.5,Positive,1963.74,4,Luxury,M-Pos,1963.74,1,78,7,Potential,2024-04,2024-04,0,1
422,843,Jason Brewer,265,Toaster,Home Appliances,2,16.76,2023-08-20,Central African Republic,422,"It works fine, but I had expected a bit more for the price.",3/30/2024,0.272222222,Positive,33.52,8,Budget,M-Pos,33.52,1,310,4,At Risk,2023-08,2023-08,0,1
423,288,Ruben Lee,223,Vacuum Cleaner,Home Appliances,4,756.22,2024-03-12,South Georgia and the South Sandwich Islands,423,"An average experience overall, neither great nor bad.",4/14/2024,-0.0125,Neutral,3024.88,3,Luxury,Neutral,6127.8,2,105,10,Champions,2023-09,2024-03,6,0
424,680,Sarah Randolph,270,Washing Machine,Home Appliances,5,725.65,2023-12-22,Oman,424,"The product arrived on time, but it's just alright.",11/18/2023,0.0,Neutral,3628.25,12,Premium,Neutral,3628.25,1,186,8,Loyal,2023-12,2023-12,0,0
425,662,Michael King,225,Smartwatch,Electronics,3,695.84,2024-04-02,Morocco,425,This is the worst item I've ever bought. I wish I could return it.,4/2/2024,-1.0,Negative,2087.52,4,Premium,S-Neg,4259.98,3,70,11,Champions,2023-08,2024-04,8,0
426,598,Heather Lambert,230,Laptop,Electronics,4,313.74,2023-08-03,Finland,426,"It works fine, but I had expected a bit more for the price.",10/20/2023,0.272222222,Positive,1254.96,8,Mid,M-Pos,1795.56,3,104,9,Loyal,2023-08,2023-08,0,0
427,734,Corey Tucker,242,Heater,Home Appliances,3,693.39,2024-02-20,Palestinian Territory,427,This product has saved me so much time and effort. I couldn't be happier.,12/1/2023,0.2,Positive,2080.17,2,Premium,M-Pos,3383.05,2,126,10,Champions,2023-07,2024-02,7,0
428,413,Brittany Knight,240,Toaster,Home Appliances,5,228.64,2023-12-09,Chile,428,It's neither great nor terrible. It's just okay.,1/14/2024,0.1,Positive,1143.1999999999998,12,Budget,Neutral,2734.72,2,188,8,Loyal,2023-12,2023-12,0,1
429,104,Richard Joseph,282,Tablet,Electronics,2,460.43,2023-12-12,Falkland Islands (Malvinas),429,This product has exceeded all my expectations. Very satisfied.,4/20/2024,0.65,Positive,920.86,12,Mid,S-Pos,1486.18,2,125,8,Loyal,2023-12,2023-12,0,0
430,960,Michael Rivera,261,Coffee Maker,Home Appliances,5,913.67,2023-12-22,Kiribati,430,It stopped working almost immediately. Waste of money.,4/11/2024,-0.2,Negative,4568.349999999999,12,Luxury,M-Neg,4568.349999999999,1,186,9,Loyal,2023-12,2023-12,0,0
431,467,Katelyn Rodriguez,282,Television,Electronics,5,874.4,2024-02-16,Belgium,431,I would not recommend this to anyone. It's a complete waste of money.,6/23/2024,-0.05,Neutral,4372.0,2,Luxury,Neutral,18054.83,5,106,11,Champions,2023-07,2024-02,7,0
432,961,Ronald Vance,225,Router,Electronics,4,532.89,2023-10-06,Saint Martin,432,Not worth the investment. Very disappointing experience.,8/11/2023,-0.465,Negative,2131.56,10,Premium,M-Neg,2131.56,1,263,7,Potential,2023-10,2023-10,0,1
433,741,Bernard Smith,264,Refrigerator,Home Appliances,5,121.09,2024-02-26,Antarctica (the territory South of 60 deg S),433,"I can't say it's amazing, but it does what I need it to do.",3/13/2024,0.6,Positive,605.45,2,Budget,S-Pos,3164.58,3,0,11,Champions,2024-02,2024-02,0,0
434,932,Jennifer Lawrence,204,Smart Bulb,Electronics,5,158.35,2024-01-26,Eritrea,434,"This item is exactly as described, and it works beautifully!",6/6/2024,0.625,Positive,791.75,1,Budget,S-Pos,2160.07,3,128,10,Champions,2024-01,2024-01,0,0
435,656,Kimberly Valdez,219,Heater,Home Appliances,4,125.08,2023-11-15,India,435,"I'm satisfied, but I'm not overly enthusiastic about this product.",8/23/2023,0.55,Positive,500.32,11,Budget,S-Pos,3450.08,3,53,11,Champions,2023-11,2023-11,0,0
436,328,Leah Vincent,217,Smart Bulb,Electronics,4,100.03,2023-12-23,Macao,436,Extremely dissatisfied. The product broke down after just one use.,12/31/2023,-0.140277778,Negative,400.12,12,Budget,M-Neg,11632.91,5,58,12,Champions,2023-12,2023-12,0,1
437,622,Jack Smith,230,Blender,Home Appliances,4,140.62,2024-05-20,Sri Lanka,437,This is one of the best products I've bought in a long time.,12/8/2023,0.475,Positive,562.48,5,Budget,M-Pos,562.48,1,36,7,Potential,2024-05,2024-05,0,0
438,728,Nicole Taylor,220,Air Conditioner,Home Appliances,5,67.16,2023-09-03,Monaco,438,"A practical product, though not particularly exciting.",3/29/2024,-0.15,Negative,335.79999999999995,9,Budget,M-Neg,335.79999999999995,1,296,4,At Risk,2023-09,2023-09,0,1
439,679,Tracy Fitzgerald,261,Washing Machine,Home Appliances,1,401.99,2024-06-24,Guinea-Bissau,439,"It works, but I've had better products for the same price.",2/28/2024,0.25,Positive,401.99,6,Mid,M-Pos,834.53,3,1,9,Loyal,2023-09,2024-06,9,1
440,141,John Brown,247,Television,Electronics,5,82.3,2023-09-24,Armenia,440,"It's good enough to keep, but I'm not excited about it.",8/19/2023,0.170833333,Positive,411.5,9,Budget,M-Pos,1645.24,3,126,9,Loyal,2023-09,2023-09,0,0
441,784,Terry Ward,260,Toaster,Home Appliances,1,545.75,2024-06-16,Korea,441,"Excellent quality, great design, and super easy to use.",9/21/2023,0.641666667,Positive,545.75,6,Premium,S-Pos,4103.79,3,9,12,Champions,2023-10,2024-06,8,0
442,147,Matthew Garcia,266,Laptop,Electronics,4,41.42,2024-02-27,Switzerland,442,"It's functional, but it's not a must-have product.",8/31/2023,0.0,Neutral,165.68,2,Budget,Neutral,1795.52,2,5,9,Loyal,2024-02,2024-02,0,1
443,380,Deborah Stephens,222,Microwave,Home Appliances,2,768.17,2023-11-19,Palau,443,This has been one of the best purchases I've made. Highly recommended!,9/29/2023,0.6,Positive,1536.34,11,Luxury,S-Pos,1536.34,1,219,5,At Risk,2023-11,2023-11,0,0
444,487,Matthew Houston,266,Toaster,Home Appliances,4,454.05,2023-10-01,Honduras,444,Everything about this product is great! It works as advertised and more.,6/17/2024,0.75,Positive,1816.2,10,Mid,S-Pos,1816.2,1,268,4,At Risk,2023-10,2023-10,0,0
445,328,Heather Parrish,262,Coffee Maker,Home Appliances,1,685.9,2024-04-28,Liberia,445,"Not good at all. The quality is very poor, and I'm disappointed.",6/1/2024,-0.54,Negative,685.9,4,Premium,S-Neg,11632.91,5,58,12,Champions,2023-12,2024-04,4,1
446,718,Stephen Gonzales,229,Camera,Electronics,1,186.69,2023-07-25,Malawi,446,I regret buying this. Save your money and look elsewhere.,5/21/2024,0.0,Neutral,186.69,7,Budget,Neutral,186.69,1,336,4,At Risk,2023-07,2023-07,0,1
447,758,Chris Moore,277,Heater,Home Appliances,2,730.58,2024-03-30,Svalbard & Jan Mayen Islands,447,"This product does its job, but I wouldn't go out of my way to buy it again.",9/27/2023,0.0,Neutral,1461.16,3,Premium,Neutral,4943.96,3,28,12,Champions,2023-07,2024-03,8,1
448,221,Jennifer Rivera,214,Smartphone,Electronics,1,978.71,2023-12-30,Peru,448,I absolutely love this product! It exceeded my expectations in every way.,10/15/2023,0.625,Positive,978.71,12,Luxury,S-Pos,3496.7299999999996,3,178,9,Loyal,2023-07,2023-12,5,1
449,590,Kevin Holland,252,Heater,Home Appliances,4,536.61,2023-07-04,Ecuador,449,Great performance and easy to use. I'm very satisfied with this product.,5/21/2024,0.627777778,Positive,2146.44,7,Premium,S-Pos,2978.2,2,80,9,Loyal,2023-07,2023-07,0,0
450,144,Kevin Taylor,265,Television,Electronics,4,352.7,2023-07-11,Uganda,450,I'm very unhappy with this purchase. It didn't meet my expectations.,10/25/2023,-0.78,Negative,1410.8,7,Mid,S-Neg,1410.8,1,350,4,At Risk,2023-07,2023-07,0,0
451,686,Christopher Nielsen,266,Vacuum Cleaner,Home Appliances,1,41.9,2023-11-30,Nepal,451,I couldn't be more pleased with this purchase. It works perfectly!,12/12/2023,0.666666667,Positive,41.9,11,Budget,S-Pos,4782.17,3,106,11,Champions,2023-11,2023-11,0,1
452,677,Sherry Luna,236,Electric Kettle,Home Appliances,1,248.26,2023-07-29,Cuba,452,Everything about this product is great! It works as advertised and more.,10/3/2023,0.75,Positive,248.26,7,Mid,S-Pos,4038.0,3,66,12,Champions,2023-07,2023-07,0,0
453,559,Kaitlin Olson,228,Laptop,Electronics,5,43.24,2024-05-13,Isle of Man,453,"It's functional, but it's not a must-have product.",5/17/2024,0.0,Neutral,216.20000000000002,5,Budget,Neutral,216.20000000000002,1,43,7,Potential,2024-05,2024-05,0,0
454,715,Kevin Saunders,279,Television,Electronics,1,408.24,2024-03-08,Madagascar,454,"An average experience overall, neither great nor bad.",3/18/2024,-0.0125,Neutral,408.24,3,Mid,Neutral,408.24,1,109,6,Potential,2024-03,2024-03,0,1
455,370,Michael Nielsen,276,Router,Electronics,2,756.84,2024-02-10,Bangladesh,455,Everything about this product is perfect. So happy with it!,6/15/2024,1.0,Positive,1513.68,2,Luxury,S-Pos,5054.03,3,136,11,Champions,2023-08,2024-02,6,0
456,335,Carlos Smith,266,Headphones,Electronics,5,993.55,2024-05-24,United States of America,456,"The customer service was fantastic, and the product arrived on time.",10/16/2023,0.4,Positive,4967.75,5,Luxury,M-Pos,11682.130000000001,4,32,12,Champions,2023-10,2024-05,7,0
457,616,Samantha Jacobs,222,Smart Bulb,Electronics,3,581.7,2023-12-27,United Arab Emirates,457,I'm very pleased with how quickly it arrived and the quality of the product.,7/2/2023,0.491666667,Positive,1745.1000000000001,12,Premium,M-Pos,5040.7,2,181,9,Loyal,2023-08,2023-12,4,0
458,729,Sherry Schmidt,296,Vacuum Cleaner,Home Appliances,3,877.5,2023-08-10,Bermuda,458,Top-notch customer service and a reliable product. Great job!,10/20/2023,1.0,Positive,2632.5,8,Luxury,S-Pos,2632.5,1,320,6,Potential,2023-08,2023-08,0,0
459,593,Stephanie Ryan,200,Printer,Electronics,3,282.4,2024-06-08,Wallis and Futuna,459,"It's decent, though I expected a little more.",4/6/2024,0.094791667,Positive,847.1999999999999,6,Mid,Neutral,1766.07,2,17,9,Loyal,2024-05,2024-06,1,0
460,893,Jessica Fisher,205,Printer,Electronics,5,500.66,2024-03-22,Malta,460,"I've used it a few times and it works, but it's not impressive.",9/6/2023,-0.35,Negative,2503.3,3,Premium,M-Neg,7396.74,3,95,11,Champions,2024-01,2024-03,2,0
461,539,Robert Clarke,248,Coffee Maker,Home Appliances,5,325.55,2023-11-09,Myanmar,461,The product was defective when I received it. Very disappointing.,3/5/2024,-0.78,Negative,1627.75,11,Mid,S-Neg,1627.75,1,229,6,Potential,2023-11,2023-11,0,0
462,923,Pam Horton,212,Coffee Maker,Home Appliances,2,306.89,2023-12-08,Burkina Faso,462,"Perfect fit, great design, and works like a charm. Very pleased!",6/21/2024,0.753125,Positive,613.78,12,Mid,S-Pos,613.78,1,200,5,At Risk,2023-12,2023-12,0,0
463,360,David Trevino,236,Router,Electronics,4,248.56,2024-02-13,Turkey,463,"It works, but it doesn't feel like a high-end product.",9/18/2023,0.0,Neutral,994.24,2,Mid,Neutral,994.24,1,133,6,Potential,2024-02,2024-02,0,1
464,656,Colin Fletcher,200,Smartwatch,Electronics,2,807.72,2024-02-05,Maldives,464,I've had a wonderful experience with this product. Definitely recommend it!,8/9/2023,0.5,Positive,1615.44,2,Luxury,M-Pos,3450.08,3,53,11,Champions,2023-11,2024-02,3,0
465,220,Jaime Harris,240,Router,Electronics,4,968.11,2023-12-01,Guyana,465,Everything about this product is great! It works as advertised and more.,9/20/2023,0.75,Positive,3872.44,12,Luxury,S-Pos,3872.44,1,207,7,Potential,2023-12,2023-12,0,1
466,209,Matthew King,268,Printer,Electronics,2,262.45,2023-12-07,Monaco,466,I would not recommend this to anyone. It's a complete waste of money.,9/5/2023,-0.05,Neutral,524.9,12,Mid,Neutral,524.9,1,201,4,At Risk,2023-12,2023-12,0,0
467,474,Wendy Sanders,226,Refrigerator,Home Appliances,4,848.66,2023-12-03,Mexico,467,It's neither great nor terrible. It's just okay.,3/15/2024,0.1,Positive,3394.64,12,Luxury,Neutral,5705.4400000000005,3,49,12,Champions,2023-12,2023-12,0,0
468,902,Cassandra Hansen,261,Router,Electronics,2,61.02,2023-10-02,Gambia,468,"The quality is fine, but I've seen better products at this price.",12/5/2023,0.458333333,Positive,122.04,10,Budget,M-Pos,122.04,1,267,4,At Risk,2023-10,2023-10,0,1
469,691,Michael Fitzgerald,284,Electric Kettle,Home Appliances,5,49.15,2023-08-11,San Marino,469,This product is decent but doesn't stand out in any way.,10/17/2023,0.166666667,Positive,245.75,8,Budget,M-Pos,6909.77,3,144,11,Champions,2023-08,2023-08,0,0
470,335,Michael Martin,227,Television,Electronics,5,727.06,2024-01-09,Iran,470,"Very poor product. It broke down after minimal use, and I'm not happy.",6/5/2024,-0.293888889,Negative,3635.2999999999997,1,Premium,M-Neg,11682.130000000001,4,32,12,Champions,2023-10,2024-01,3,1
471,904,Joshua Terry,290,Tablet,Electronics,2,870.78,2023-07-16,Central African Republic,471,"It's a decent product, but it doesn't offer the best value for the price.",8/16/2023,0.583333333,Positive,1741.56,7,Luxury,S-Pos,2406.8199999999997,2,237,8,Loyal,2023-07,2023-07,0,0
472,498,Abigail Davis,218,Washing Machine,Home Appliances,1,219.69,2023-12-26,Vanuatu,472,I've been using it for a while now and it's performing perfectly.,10/21/2023,1.0,Positive,219.69,12,Budget,S-Pos,739.99,2,83,7,Potential,2023-12,2023-12,0,1
473,714,Austin Walker,210,Laptop,Electronics,4,915.3,2024-02-17,Argentina,473,I'm frustrated with this product. It's not what I hoped for at all.,11/4/2023,-0.7,Negative,3661.2,2,Luxury,S-Neg,3661.2,1,129,9,Loyal,2024-02,2024-02,0,0
474,841,William Mendez,266,Printer,Electronics,2,556.56,2023-10-15,Rwanda,474,"It's decent, though I expected a little more.",10/2/2023,0.094791667,Positive,1113.12,10,Premium,Neutral,1113.12,1,254,5,At Risk,2023-10,2023-10,0,1
475,711,Raymond Thompson,263,Coffee Maker,Home Appliances,4,538.31,2023-12-13,Algeria,475,I absolutely love this! It's even better than I expected.,6/22/2024,0.341666667,Positive,2153.24,12,Premium,M-Pos,3839.72,2,141,11,Champions,2023-12,2023-12,0,0
476,306,Tara Holmes,224,Washing Machine,Home Appliances,3,366.05,2023-07-09,Slovenia,476,"The product works as expected, but it's nothing special.",9/5/2023,0.128571429,Positive,1098.15,7,Mid,M-Pos,1701.58,3,110,9,Loyal,2023-07,2023-07,0,1
477,713,Melissa Gilbert,286,Air Conditioner,Home Appliances,1,804.79,2023-07-10,Guyana,477,Great performance and easy to use. I'm very satisfied with this product.,5/28/2024,0.627777778,Positive,804.79,7,Luxury,S-Pos,804.79,1,351,4,At Risk,2023-07,2023-07,0,0
478,344,Vanessa Miller,235,Toaster,Home Appliances,2,377.0,2024-04-23,Iran,478,"I'm satisfied, but I'm not overly enthusiastic about this product.",12/18/2023,0.55,Positive,754.0,4,Mid,S-Pos,1109.1,2,42,9,Loyal,2024-04,2024-04,0,0
479,461,Jennifer Gonzalez,201,Blender,Home Appliances,5,865.44,2024-04-07,Romania,479,So impressed by the quality. This product truly delivers.,10/26/2023,1.0,Positive,4327.200000000001,4,Luxury,S-Pos,6102.840000000001,3,79,11,Champions,2023-07,2024-04,9,1
480,170,Krista Barber,271,Smartphone,Electronics,3,557.78,2024-06-15,Mozambique,480,Great product and excellent customer support. Totally worth it!,4/21/2024,0.725,Positive,1673.34,6,Premium,S-Pos,2975.91,3,10,11,Champions,2023-08,2024-06,10,0
481,456,Robert Perez,224,Washing Machine,Home Appliances,2,204.23,2023-12-19,Venezuela,481,"I love this item. It's sturdy, functional, and well-made.",1/1/2024,0.5,Positive,408.46,12,Budget,M-Pos,1906.78,4,10,10,Champions,2023-12,2023-12,0,0
482,513,Debbie Russell,213,Printer,Electronics,5,835.03,2024-01-28,Barbados,482,Absolutely love this product! It's a game-changer.,9/25/2023,0.625,Positive,4175.15,1,Luxury,S-Pos,6602.799999999999,2,149,10,Champions,2023-09,2024-01,4,0
483,615,Travis Pratt,232,Heater,Home Appliances,3,264.75,2024-05-31,Martinique,483,"A practical product, though not particularly exciting.",11/10/2023,-0.15,Negative,794.25,5,Mid,M-Neg,2725.9300000000003,2,25,10,Champions,2024-02,2024-05,3,0
484,932,Danielle Ramos,248,Air Conditioner,Home Appliances,4,176.55,2024-01-30,Liberia,484,This has made my life so much easier. I highly recommend it!,11/20/2023,0.2,Positive,706.2,1,Budget,M-Pos,2160.07,3,128,10,Champions,2024-01,2024-01,0,0
485,888,Gerald Rowe,287,Microwave,Home Appliances,2,723.11,2023-12-21,Ukraine,485,The product is okay but nothing too special.,5/24/2024,0.428571429,Positive,1446.22,12,Premium,M-Pos,4335.68,3,187,10,Champions,2023-07,2023-12,5,0
486,700,Karen Scott,248,Microwave,Home Appliances,5,990.42,2024-02-27,Solomon Islands,486,This is hands down the best purchase I've made this year.,9/23/2023,0.422222222,Positive,4952.099999999999,2,Luxury,M-Pos,4952.099999999999,1,119,9,Loyal,2024-02,2024-02,0,1
487,325,Crystal Stewart,245,Router,Electronics,1,840.68,2024-01-12,Martinique,487,The quality is outstanding. I'm extremely impressed.,9/9/2023,0.75,Positive,840.68,1,Luxury,S-Pos,978.79,2,165,7,Potential,2023-09,2024-01,4,0
488,109,Deborah Mitchell,251,Smartphone,Electronics,1,418.27,2024-03-13,San Marino,488,"I had high hopes for this, but it was a total letdown.",7/26/2023,0.08,Positive,418.27,3,Mid,Neutral,4289.110000000001,2,104,10,Champions,2024-01,2024-03,2,0
489,940,Justin White,240,Laptop,Electronics,2,19.05,2023-11-10,Cuba,489,"It's a decent product, but it doesn't offer the best value for the price.",4/9/2024,0.583333333,Positive,38.1,11,Budget,S-Pos,2130.3300000000004,3,145,10,Champions,2023-11,2023-11,0,1
490,687,Travis Vega,224,Toaster,Home Appliances,1,621.66,2024-01-05,Saint Pierre and Miquelon,490,"Excellent quality, great design, and super easy to use.",10/18/2023,0.641666667,Positive,621.66,1,Premium,S-Pos,621.66,1,172,5,At Risk,2024-01,2024-01,0,1
491,304,David Baker,229,Air Conditioner,Home Appliances,1,16.55,2023-09-12,Syrian Arab Republic,491,I've been using it for a while now and it's performing perfectly.,11/19/2023,1.0,Positive,16.55,9,Budget,S-Pos,16.55,1,287,3,Lost,2023-09,2023-09,0,0
492,355,Heather Maxwell,215,Blender,Home Appliances,1,534.12,2024-06-17,Belgium,492,This product does exactly what I wanted it to do. Very pleased.,5/2/2024,0.45,Positive,534.12,6,Premium,M-Pos,3636.62,2,8,11,Champions,2023-09,2024-06,9,0
493,792,Katherine Smith,269,Heater,Home Appliances,3,26.97,2023-07-12,Thailand,493,Perfect fit for my needs. Will definitely order again.,7/19/2023,0.466666667,Positive,80.91,7,Budget,M-Pos,3762.31,2,263,9,Loyal,2023-07,2023-07,0,0
494,593,Ethan Villanueva,273,Microwave,Home Appliances,1,918.87,2024-05-28,Falkland Islands (Malvinas),494,"I've used it a few times and it works, but it's not impressive.",6/10/2024,-0.35,Negative,918.87,5,Luxury,M-Neg,1766.07,2,17,9,Loyal,2024-05,2024-05,0,0
495,602,Phillip Dixon,250,Television,Electronics,2,623.58,2023-09-20,Sao Tome and Principe,495,"I've used it a few times and it works, but it's not impressive.",2/11/2024,-0.35,Negative,1247.16,9,Premium,M-Neg,3225.02,3,147,10,Champions,2023-09,2023-09,0,0
496,690,Joseph Henderson,269,Toaster,Home Appliances,3,796.99,2023-07-08,Macao,496,I absolutely love this product! It exceeded my expectations in every way.,9/14/2023,0.625,Positive,2390.9700000000003,7,Luxury,S-Pos,3976.1500000000005,2,255,8,Loyal,2023-07,2023-07,0,0
497,455,Michael Thompson,215,Camera,Electronics,4,464.41,2024-03-23,Malaysia,497,"Not good at all. The quality is very poor, and I'm disappointed.",12/14/2023,-0.54,Negative,1857.64,3,Mid,S-Neg,1857.64,1,94,6,Potential,2024-03,2024-03,0,0
498,571,Adam Craig,248,Television,Electronics,3,687.2,2024-02-06,Bolivia,498,"I had high hopes, but this product failed to deliver.",11/14/2023,-0.17,Negative,2061.6000000000004,2,Premium,M-Neg,6844.75,2,140,10,Champions,2023-10,2024-02,4,0
499,433,Scott Lopez,233,Smartphone,Electronics,1,411.23,2023-09-26,Ethiopia,499,"I was expecting something better, but this product is just average.",1/25/2024,0.175,Positive,411.23,9,Mid,M-Pos,2062.11,2,210,8,Loyal,2023-09,2023-09,0,1
500,582,Grace White,254,Heater,Home Appliances,4,65.55,2023-09-15,Italy,500,This is one of the best products I've bought in a long time.,2/9/2024,0.475,Positive,262.2,9,Budget,M-Pos,3940.52,2,153,9,Loyal,2023-09,2023-09,0,1
501,817,Holly Morales,257,Headphones,Electronics,1,504.86,2023-09-03,Montenegro,501,"The product functions well, but I feel it could be improved in some areas.",9/29/2023,0.0,Neutral,504.86,9,Premium,Neutral,7172.849999999999,3,41,12,Champions,2023-09,2023-09,0,0
502,234,Melissa Olsen,292,Toaster,Home Appliances,5,977.56,2023-10-08,Spain,502,"The product is decent, but I've come across better quality.",5/14/2024,0.333333333,Positive,4887.799999999999,10,Luxury,M-Pos,7676.16,2,130,10,Champions,2023-10,2023-10,0,0
503,341,Selena Gonzalez,294,Router,Electronics,1,237.47,2023-08-23,Lebanon,503,I've had a wonderful experience with this product. Definitely recommend it!,1/23/2024,0.5,Positive,237.47,8,Budget,M-Pos,2227.71,3,56,11,Champions,2023-08,2023-08,0,0
504,925,Javier Taylor,280,Washing Machine,Home Appliances,1,924.92,2024-01-12,Marshall Islands,504,Not worth the investment. Very disappointing experience.,12/12/2023,-0.465,Negative,924.92,1,Luxury,M-Neg,924.92,1,165,6,Potential,2024-01,2024-01,0,1
505,837,John King,272,Heater,Home Appliances,5,661.53,2023-07-14,Indonesia,505,"It didn't work from the start, and I'm very upset with the quality.",7/11/2023,0.2,Positive,3307.6499999999996,7,Premium,M-Pos,4596.95,2,343,9,Loyal,2023-07,2023-07,0,0
506,201,Amy Cervantes,260,Camera,Electronics,1,961.85,2024-05-16,Niue,506,It's easy to use and super efficient. I'm so glad I bought it.,12/29/2023,0.422222222,Positive,961.85,5,Luxury,M-Pos,1383.72,2,40,9,Loyal,2023-11,2024-05,6,0
507,198,George Ward,271,Printer,Electronics,1,306.28,2024-01-28,Venezuela,507,The quality and performance of this product are top-notch.,11/25/2023,1.0,Positive,306.28,1,Mid,S-Pos,306.28,1,149,5,At Risk,2024-01,2024-01,0,1
508,929,Alejandro Martinez,286,Smart Bulb,Electronics,4,680.26,2024-02-16,Congo,508,I couldn't be more pleased with this purchase. It works perfectly!,2/25/2024,0.666666667,Positive,2721.04,2,Premium,S-Pos,2721.04,1,130,9,Loyal,2024-02,2024-02,0,1
509,690,Mariah Thompson,299,Coffee Maker,Home Appliances,2,792.59,2023-10-14,Guinea,509,The quality is outstanding. I'm extremely impressed.,7/3/2023,0.75,Positive,1585.18,10,Luxury,S-Pos,3976.1500000000005,2,255,8,Loyal,2023-07,2023-10,3,1
510,432,Katherine Doyle,210,Router,Electronics,3,63.16,2023-11-20,New Zealand,510,"Not bad, but there's room for improvement in some areas.",7/3/2023,0.35,Positive,189.48,11,Budget,M-Pos,189.48,1,218,4,At Risk,2023-11,2023-11,0,1
511,393,Tyler Oneill,281,Vacuum Cleaner,Home Appliances,1,347.19,2024-05-04,Vanuatu,511,"I was hoping for something better, but this item is completely useless.",12/12/2023,0.0,Neutral,347.19,5,Mid,Neutral,347.19,1,52,6,Potential,2024-05,2024-05,0,0
512,445,Logan Sullivan,209,Toaster,Home Appliances,1,637.78,2023-07-26,Central African Republic,512,Very poor quality. It's already falling apart after a few weeks of use.,2/11/2024,-0.36,Negative,637.78,7,Premium,M-Neg,1029.86,2,104,8,Loyal,2023-07,2023-07,0,0
513,451,Evan Carter,234,Air Conditioner,Home Appliances,2,362.25,2024-02-16,Oman,513,"It works, but I've had better products for the same price.",12/28/2023,0.25,Positive,724.5,2,Mid,M-Pos,4805.56,3,13,12,Champions,2024-02,2024-02,0,1
514,504,Jeremy Roy,246,Coffee Maker,Home Appliances,2,682.9,2024-04-11,Myanmar,514,"The product arrived on time, and I couldn't be happier with it.",6/18/2024,0.0,Neutral,1365.8,4,Premium,Neutral,1658.24,2,55,9,Loyal,2024-04,2024-04,0,1
515,633,Jennifer White,202,Refrigerator,Home Appliances,5,302.43,2023-08-13,Saint Lucia,515,"The product arrived on time, but it's just alright.",4/9/2024,0.0,Neutral,1512.15,8,Mid,Neutral,3891.66,2,164,9,Loyal,2023-08,2023-08,0,0
516,340,Teresa Haynes,210,Laptop,Electronics,1,275.29,2023-09-15,Chad,516,I've had better products for less money. This one is definitely not worth it.,3/21/2024,0.061111111,Positive,275.29,9,Mid,Neutral,1634.69,2,227,7,Potential,2023-09,2023-09,0,0
517,506,Arthur Johns,270,Microwave,Home Appliances,4,323.51,2023-07-16,Anguilla,517,I don't recommend this at all. It's not functional and doesn't last.,1/21/2024,0.0,Neutral,1294.04,7,Mid,Neutral,1294.04,1,345,4,At Risk,2023-07,2023-07,0,0
518,889,Phillip Miller,233,Laptop,Electronics,1,943.53,2024-02-21,Cape Verde,518,The product is of poor quality. It doesn't last long and doesn't do what it should.,8/28/2023,-0.15,Negative,943.53,2,Luxury,M-Neg,2033.49,3,125,10,Champions,2023-09,2024-02,5,1
519,186,Stacey Parker,231,Toaster,Home Appliances,3,111.21,2024-04-07,Finland,519,"It's not great, but it's not bad either. It's somewhere in between.",2/17/2024,-0.025,Neutral,333.63,4,Budget,Neutral,1106.45,2,79,8,Loyal,2023-07,2024-04,9,1
