TransactionID,CustomerID,CustomerName,ProductID,ProductName,ProductCategory,PurchaseQuantity,PurchasePrice,PurchaseDate,Country,ReviewID,ReviewText,ReviewDate,ReviewSentiment,SentimentClass,Revenue,Month,PriceSegment,SentimentBucket,TotalSpend,Frequency,Recency,RFM_Score,Segment,Cohort,TxMonth,Index,Subscription
727,443,Robert Scott,274,Air Conditioner,Home Appliances,1,272.56,2023-11-24,Kyrgyz Republic,727,Worth every penny! Amazing quality and service.,2/21/2024,0.4875,Positive,272.56,11,Mid,M-Pos,272.56,1,214,4,At Risk,2023-11,2023-11,0,0
728,891,Dana Powers,298,Laptop,Electronics,3,264.09,2023-09-09,Maldives,728,This doesn't even deserve one star. Completely useless and unreliable.,2/4/2024,-0.5,Negative,792.27,9,Mid,S-Neg,1909.23,2,290,8,Loyal,2023-08,2023-09,1,1
729,445,Wendy Edwards,201,Smartphone,Electronics,1,392.08,2024-03-13,Algeria,729,"The product is fine, but it lacks the features I was hoping for.",3/16/2024,0.416666667,Positive,392.08,3,Mid,M-Pos,1029.86,2,104,8,Loyal,2023-07,2024-03,8,0
730,951,Jason Fox,287,Microwave,Home Appliances,4,498.15,2023-12-16,Guernsey,730,"Customer service was unhelpful, and the product is subpar.",7/15/2023,0.0,Neutral,1992.6,12,Premium,Neutral,3341.8,2,72,10,Champions,2023-12,2023-12,0,0
731,324,Darlene Johnson,279,Toaster,Home Appliances,5,381.59,2023-07-31,Azerbaijan,731,I'm amazed by how well it works. Great value for the price!,8/30/2023,1.0,Positive,1907.9499999999998,7,Mid,S-Pos,6689.629999999999,3,287,9,Loyal,2023-07,2023-07,0,0
732,708,Sara Sampson,281,Electric Kettle,Home Appliances,2,171.03,2023-08-12,Russian Federation,732,"Fantastic quality, and the performance is just amazing. Highly recommend!",2/6/2024,0.4,Positive,342.06,8,Budget,M-Pos,1326.06,2,235,7,Potential,2023-08,2023-08,0,1
733,222,Larry Bennett,297,Smartphone,Electronics,3,29.88,2024-06-09,Oman,733,This product has exceeded all my expectations. Very satisfied.,9/5/2023,0.65,Positive,89.64,6,Budget,S-Pos,89.64,1,16,6,Potential,2024-06,2024-06,0,0
734,679,Cathy Rodriguez,223,Refrigerator,Home Appliances,1,348.39,2023-10-02,French Polynesia,734,The quality and performance of this product are top-notch.,11/18/2023,1.0,Positive,348.39,10,Mid,S-Pos,834.53,3,1,9,Loyal,2023-09,2023-10,1,0
735,578,Angela Chavez,235,Microwave,Home Appliances,1,551.58,2024-04-19,Japan,735,I'm really impressed with the quality and the results. 10/10!,12/21/2023,1.0,Positive,551.58,4,Premium,S-Pos,551.58,1,67,7,Potential,2024-04,2024-04,0,0
736,808,Patricia Morris,220,Camera,Electronics,5,985.42,2024-04-24,Barbados,736,The product does exactly what it's supposed to do. Very happy.,2/10/2024,0.625,Positive,4927.099999999999,4,Luxury,S-Pos,8357.65,2,62,12,Champions,2023-08,2024-04,8,1
737,383,Janet Cook,207,Blender,Home Appliances,4,943.02,2023-10-04,Zimbabwe,737,"It's okay overall, but I expected a bit more based on the reviews.",12/7/2023,0.225,Positive,3772.08,10,Luxury,M-Pos,4577.7,2,161,9,Loyal,2023-10,2023-10,0,0
738,932,Jeremiah Vasquez,225,Smart Bulb,Electronics,4,165.53,2024-02-18,India,738,This product has made my daily routine so much easier. Highly recommend.,6/26/2023,0.12,Positive,662.12,2,Budget,M-Pos,2160.07,3,128,10,Champions,2024-01,2024-02,1,1
739,282,Ashley Fernandez,255,Camera,Electronics,2,974.65,2023-09-18,New Zealand,739,"It didn't work from the start, and I'm very upset with the quality.",8/4/2023,0.2,Positive,1949.3,9,Luxury,M-Pos,4586.63,2,34,11,Champions,2023-09,2023-09,0,0
740,758,Jeremy Green,204,Heater,Home Appliances,5,272.61,2023-07-24,Barbados,740,I'm really impressed with the quality and the results. 10/10!,4/4/2024,1.0,Positive,1363.0500000000002,7,Mid,S-Pos,4943.96,3,28,12,Champions,2023-07,2023-07,0,0
741,685,Paula Smith,263,Washing Machine,Home Appliances,2,104.96,2023-08-22,Palau,741,"It broke within a few days of use, and customer service didn't help at all.",8/14/2023,-0.2,Negative,209.92,8,Budget,M-Neg,5353.36,3,249,9,Loyal,2023-08,2023-08,0,0
742,755,Andrew Myers,219,Electric Kettle,Home Appliances,5,841.46,2024-03-23,Greenland,742,"The quality is fine, but I've seen better products at this price.",5/27/2024,0.458333333,Positive,4207.3,3,Luxury,M-Pos,8125.240000000001,4,94,11,Champions,2023-10,2024-03,5,0
743,500,Kaylee Case,262,Smartphone,Electronics,3,13.78,2023-12-28,Jordan,743,I don't recommend this at all. It's not functional and doesn't last.,10/16/2023,0.0,Neutral,41.339999999999996,12,Budget,Neutral,41.339999999999996,1,180,4,At Risk,2023-12,2023-12,0,1
744,513,Priscilla Floyd,269,Smartwatch,Electronics,5,485.53,2023-09-21,Afghanistan,744,"I have mixed feelings. It's fine, but I was expecting a bit more.",4/9/2024,0.305555556,Positive,2427.6499999999996,9,Premium,M-Pos,6602.799999999999,2,149,10,Champions,2023-09,2023-09,0,0
745,493,Sabrina Olson,272,Smartphone,Electronics,2,179.12,2024-01-19,Vietnam,745,This product has exceeded all my expectations. I'm thrilled with it.,2/25/2024,0.6,Positive,358.24,1,Budget,S-Pos,358.24,1,158,4,At Risk,2024-01,2024-01,0,0
746,467,Eric Brown,282,Refrigerator,Home Appliances,4,845.33,2023-07-31,Haiti,746,I tried it once and it didn't work at all. Wouldn't recommend to anyone.,6/21/2024,0.0,Neutral,3381.32,7,Luxury,Neutral,18054.83,5,106,11,Champions,2023-07,2023-07,0,1
747,647,Gina Randall,297,Coffee Maker,Home Appliances,4,494.21,2024-04-18,French Guiana,747,The product does exactly what it's supposed to do. Very happy.,9/6/2023,0.625,Positive,1976.84,4,Premium,S-Pos,5062.72,2,68,11,Champions,2024-03,2024-04,1,0
748,763,Julian Ponce,284,Refrigerator,Home Appliances,5,393.65,2023-09-08,French Southern Territories,748,"It's functional, but I don't feel strongly about it either way.",2/29/2024,0.433333333,Positive,1968.25,9,Mid,M-Pos,2219.48,2,231,9,Loyal,2023-09,2023-09,0,0
749,812,Brian Barker,262,Coffee Maker,Home Appliances,3,194.72,2023-07-28,Turks and Caicos Islands,749,"The quality is fine, but I've seen better products at this price.",10/9/2023,0.458333333,Positive,584.16,7,Budget,M-Pos,3714.8999999999996,4,160,10,Champions,2023-07,2023-07,0,1
750,747,Collin Johnson,203,Smartwatch,Electronics,4,470.41,2024-03-31,Namibia,750,Very high-quality product. I would buy it again without hesitation.,12/6/2023,0.2,Positive,1881.64,3,Mid,M-Pos,4518.34,2,86,11,Champions,2023-07,2024-03,8,0
751,344,Arthur Fernandez MD,268,Smartwatch,Electronics,5,71.02,2024-05-14,Sudan,751,This is exactly what I was looking for. I'm so glad I bought it!,1/16/2024,0.4375,Positive,355.09999999999997,5,Budget,M-Pos,1109.1,2,42,9,Loyal,2024-04,2024-05,1,0
752,560,Alexis Morgan,243,Laptop,Electronics,3,810.1,2024-04-26,Saint Helena,752,The item broke after a few days of use. Not happy at all.,9/29/2023,-0.3,Negative,2430.3,4,Luxury,M-Neg,3095.53,3,60,11,Champions,2023-07,2024-04,9,1
753,143,Daniel Valdez,266,Electric Kettle,Home Appliances,2,558.07,2023-12-21,Wallis and Futuna,753,This product is absolutely amazing. I'm recommending it to all my friends.,3/5/2024,0.6,Positive,1116.14,12,Premium,S-Pos,1116.14,1,187,5,At Risk,2023-12,2023-12,0,0
754,794,Kimberly Figueroa,229,Heater,Home Appliances,4,965.97,2024-06-19,Barbados,754,I'm really impressed with the quality and the results. 10/10!,9/16/2023,1.0,Positive,3863.88,6,Luxury,S-Pos,3863.88,1,6,10,Champions,2024-06,2024-06,0,0
755,137,Katherine Smith,279,Electric Kettle,Home Appliances,2,481.5,2023-07-13,Ecuador,755,The quality and performance of this product are top-notch.,1/25/2024,1.0,Positive,963.0,7,Mid,S-Pos,2942.08,3,135,10,Champions,2023-07,2023-07,0,0
756,818,Alexis Chen,239,Printer,Electronics,1,507.08,2024-05-09,South Africa,756,I'm very happy with the performance. It does exactly what I need.,11/26/2023,0.625,Positive,507.08,5,Premium,S-Pos,507.08,1,47,7,Potential,2024-05,2024-05,0,1
757,199,Christopher Garza,213,Laptop,Electronics,4,181.15,2023-08-09,Luxembourg,757,I regret buying this. The product is ineffective and badly made.,3/3/2024,-0.7,Negative,724.6,8,Budget,S-Neg,2918.7,2,133,9,Loyal,2023-08,2023-08,0,0
758,709,Connie Brock,254,Television,Electronics,2,134.92,2023-11-04,Sudan,758,This product is terrible. It broke after the second use and didn't perform as expected.,4/1/2024,-0.366666667,Negative,269.84,11,Budget,M-Neg,269.84,1,234,4,At Risk,2023-11,2023-11,0,0
759,955,Miss Erika Daugherty,273,Refrigerator,Home Appliances,4,209.9,2024-01-24,Burundi,759,This product has exceeded all my expectations. I'm thrilled with it.,1/31/2024,0.6,Positive,839.6,1,Budget,S-Pos,839.6,1,153,6,Potential,2024-01,2024-01,0,1
760,429,Rebecca Duran,275,Smart Bulb,Electronics,3,326.55,2023-09-01,Grenada,760,This is the worst item I've ever bought. I wish I could return it.,2/25/2024,-1.0,Negative,979.6500000000001,9,Mid,S-Neg,979.6500000000001,1,298,4,At Risk,2023-09,2023-09,0,1
761,164,Charles Perry,289,Laptop,Electronics,4,560.8,2023-11-16,Mexico,761,"This item is exactly as described, and it works beautifully!",11/4/2023,0.625,Positive,2243.2,11,Premium,S-Pos,2243.2,1,222,6,Potential,2023-11,2023-11,0,0
762,268,Timothy Williams,212,Washing Machine,Home Appliances,5,463.58,2024-04-28,Tanzania,762,Wonderful product! The quality and performance are unmatched.,3/28/2024,1.0,Positive,2317.9,4,Mid,S-Pos,2317.9,1,58,8,Loyal,2024-04,2024-04,0,0
763,747,Paula Smith,262,Smart Bulb,Electronics,5,527.34,2023-07-27,Albania,763,"It's acceptable, but I don't have any strong feelings about it.",2/26/2024,0.433333333,Positive,2636.7000000000003,7,Premium,M-Pos,4518.34,2,86,11,Champions,2023-07,2023-07,0,0
764,107,Brandon Pearson,236,Refrigerator,Home Appliances,4,158.15,2023-12-04,Puerto Rico,764,Very high-quality product. I would buy it again without hesitation.,9/26/2023,0.2,Positive,632.6,12,Budget,M-Pos,1510.2800000000002,2,30,9,Loyal,2023-12,2023-12,0,1
765,926,Karen Martinez,218,Laptop,Electronics,5,781.75,2024-02-29,Faroe Islands,765,I couldn't be happier with my purchase. It's perfect for what I needed.,8/7/2023,1.0,Positive,3908.75,2,Luxury,S-Pos,5515.37,2,117,11,Champions,2023-09,2024-02,5,0
766,635,David Thompson,288,Heater,Home Appliances,3,879.11,2023-07-10,Nauru,766,Impressed with the durability and performance of this product.,1/16/2024,1.0,Positive,2637.33,7,Luxury,S-Pos,9046.7,3,76,11,Champions,2023-07,2023-07,0,0
767,284,Lisa Miller,238,Coffee Maker,Home Appliances,4,576.3,2023-11-08,Italy,767,"It works fine, but I had expected a bit more for the price.",8/19/2023,0.272222222,Positive,2305.2,11,Premium,M-Pos,5323.43,3,133,11,Champions,2023-06,2023-11,5,1
768,104,Cheryl Downs,212,Blender,Home Appliances,2,282.66,2024-02-21,Guyana,768,"It's okay overall, but I expected a bit more based on the reviews.",1/5/2024,0.225,Positive,565.32,2,Mid,M-Pos,1486.18,2,125,8,Loyal,2023-12,2024-02,2,1
769,983,Kimberly Robinson,298,Smart Bulb,Electronics,5,684.0,2024-02-24,Palestinian Territory,769,This has been one of the best purchases I've made. Highly recommended!,5/10/2024,0.6,Positive,3420.0,2,Premium,S-Pos,3798.13,2,122,11,Champions,2023-12,2024-02,2,0
770,313,Cory Hogan,287,Blender,Home Appliances,4,890.68,2024-05-18,United States Minor Outlying Islands,770,I couldn't be more pleased with this purchase. It works perfectly!,12/10/2023,0.666666667,Positive,3562.72,5,Luxury,S-Pos,3562.72,1,38,9,Loyal,2024-05,2024-05,0,1
771,585,Christopher Livingston Jr.,246,Vacuum Cleaner,Home Appliances,1,748.29,2023-10-14,Cote d'Ivoire,771,This has been one of the best purchases I've made. Highly recommended!,4/7/2024,0.6,Positive,748.29,10,Luxury,S-Pos,4524.84,3,75,11,Champions,2023-10,2023-10,0,0
772,545,Luis Wu,258,Toaster,Home Appliances,1,344.49,2023-07-12,Bosnia and Herzegovina,772,This is one of the best products I've bought in a long time.,9/21/2023,0.475,Positive,344.49,7,Mid,M-Pos,344.49,1,349,4,At Risk,2023-07,2023-07,0,1
773,858,Joshua Moore,203,Washing Machine,Home Appliances,3,844.42,2023-12-31,Malawi,773,Impressed with the durability and performance of this product.,4/17/2024,1.0,Positive,2533.2599999999998,12,Luxury,S-Pos,2533.2599999999998,1,177,7,Potential,2023-12,2023-12,0,0
774,218,David Wallace,274,Television,Electronics,2,307.48,2023-10-30,Italy,774,"The product arrived on time, but it's just alright.",7/25/2023,0.0,Neutral,614.96,10,Mid,Neutral,614.96,1,239,3,Lost,2023-10,2023-10,0,0
775,303,Stephanie Hall,214,Toaster,Home Appliances,3,731.51,2023-10-30,Denmark,775,I absolutely love this! It's even better than I expected.,4/13/2024,0.341666667,Positive,2194.5299999999997,10,Premium,M-Pos,4213.23,2,239,8,Loyal,2023-07,2023-10,3,1
776,200,Jason Gonzalez,228,Television,Electronics,4,219.28,2023-07-24,Latvia,776,"I love this item. It's sturdy, functional, and well-made.",8/20/2023,0.5,Positive,877.12,7,Budget,M-Pos,3692.48,2,286,8,Loyal,2023-07,2023-07,0,0
777,699,Dr. Charles Reilly,258,Air Conditioner,Home Appliances,5,868.52,2023-09-03,Iceland,777,"It's fine for casual use, but I wouldn't use it for anything heavy.",7/25/2023,-0.094444444,Negative,4342.6,9,Luxury,Neutral,8295.400000000001,3,139,11,Champions,2023-07,2023-09,2,0
778,482,Nathan Chen,234,Router,Electronics,2,74.96,2023-09-12,Grenada,778,Impressed with the durability and performance of this product.,7/22/2023,1.0,Positive,149.92,9,Budget,S-Pos,1163.47,2,46,9,Loyal,2023-09,2023-09,0,1
779,230,Keith Ramirez,214,Microwave,Home Appliances,5,880.54,2024-05-21,Lao People's Democratic Republic,779,I regret buying this. The product is ineffective and badly made.,12/10/2023,-0.7,Negative,4402.7,5,Luxury,S-Neg,7241.53,3,35,12,Champions,2023-10,2024-05,7,1
780,569,Philip Robinson,237,Headphones,Electronics,2,876.43,2024-02-15,Cayman Islands,780,"It's functional, but I don't feel strongly about it either way.",6/25/2024,0.433333333,Positive,1752.86,2,Luxury,M-Pos,2397.87,2,131,9,Loyal,2023-11,2024-02,3,0
781,908,Tiffany Whitehead,273,Smartphone,Electronics,2,42.74,2024-01-26,Timor-Leste,781,This product is absolutely amazing. I'm recommending it to all my friends.,10/2/2023,0.6,Positive,85.48,1,Budget,S-Pos,85.48,1,151,5,At Risk,2024-01,2024-01,0,0
782,335,Scott Burns,227,Camera,Electronics,2,281.24,2024-02-10,Lebanon,782,This product is absolutely amazing. I'm recommending it to all my friends.,1/11/2024,0.6,Positive,562.48,2,Mid,S-Pos,11682.130000000001,4,32,12,Champions,2023-10,2024-02,4,0
783,957,Adrian Patterson,231,Heater,Home Appliances,4,639.06,2023-09-30,Greece,783,"It's functional, but I don't feel strongly about it either way.",8/4/2023,0.433333333,Positive,2556.24,9,Premium,M-Pos,4400.46,2,19,12,Champions,2023-09,2023-09,0,0
784,544,Stephanie Vargas,219,Smartphone,Electronics,2,378.74,2024-06-14,Montenegro,784,"The quality is fine, but I've seen better products at this price.",3/20/2024,0.458333333,Positive,757.48,6,Mid,M-Pos,1550.29,2,11,9,Loyal,2023-11,2024-06,7,0
785,105,Andrew Esparza,293,Microwave,Home Appliances,4,591.01,2024-04-19,Macedonia,785,"I can't say it's amazing, but it does what I need it to do.",9/17/2023,0.6,Positive,2364.04,4,Premium,S-Pos,2364.04,1,67,8,Loyal,2024-04,2024-04,0,0
786,134,James Pacheco,289,Toaster,Home Appliances,2,839.28,2024-05-09,Bolivia,786,"It's a decent product for the price, though there are better alternatives.",3/2/2024,0.333333333,Positive,1678.56,5,Luxury,M-Pos,7339.8099999999995,3,47,12,Champions,2023-09,2024-05,8,1
787,563,Bradley Mullins DDS,252,Refrigerator,Home Appliances,3,37.18,2023-09-18,Bulgaria,787,The product does exactly what it's supposed to do. Very happy.,2/7/2024,0.625,Positive,111.53999999999999,9,Budget,S-Pos,2356.59,2,53,10,Champions,2023-09,2023-09,0,0
788,467,Matthew Davis,261,Headphones,Electronics,5,782.03,2024-03-11,Gambia,788,This is one of the best products I've bought in a long time.,2/26/2024,0.475,Positive,3910.1499999999996,3,Luxury,M-Pos,18054.83,5,106,11,Champions,2023-07,2024-03,8,0
789,265,Shannon Burgess,203,Television,Electronics,2,680.92,2023-12-19,Kyrgyz Republic,789,Top-notch customer service and a reliable product. Great job!,7/15/2023,1.0,Positive,1361.84,12,Premium,S-Pos,2068.74,3,178,9,Loyal,2023-12,2023-12,0,0
790,890,Michael Lopez,247,Coffee Maker,Home Appliances,5,29.85,2024-02-24,Kyrgyz Republic,790,"It's not great, but it's not bad either. It's somewhere in between.",3/31/2024,-0.025,Neutral,149.25,2,Budget,Neutral,3893.4,2,122,11,Champions,2023-10,2024-02,4,1
791,820,Shannon Jones,288,Tablet,Electronics,2,650.9,2023-11-02,Malta,791,"It works so well, and it's exactly what I needed for my project.",9/12/2023,0.25,Positive,1301.8,11,Premium,M-Pos,1301.8,1,236,5,At Risk,2023-11,2023-11,0,0
792,133,Paul Wolfe,278,Television,Electronics,3,612.26,2024-01-22,Montserrat,792,Worth every penny! Amazing quality and service.,1/4/2024,0.4875,Positive,1836.78,1,Premium,M-Pos,1836.78,1,155,5,At Risk,2024-01,2024-01,0,0
793,913,Michael Oliver,242,Washing Machine,Home Appliances,4,896.53,2024-04-06,Venezuela,793,"It's a basic product. Works, but no wow factor.",11/15/2023,-0.025,Neutral,3586.12,4,Luxury,Neutral,4474.54,3,80,11,Champions,2024-01,2024-04,3,0
794,156,Susan Cox,206,Air Conditioner,Home Appliances,3,226.03,2023-08-08,Hungary,794,"I love this item. It's sturdy, functional, and well-made.",11/5/2023,0.5,Positive,678.09,8,Budget,M-Pos,1915.8500000000001,3,148,10,Champions,2023-08,2023-08,0,0
795,474,Andrew Richardson,282,Heater,Home Appliances,5,403.18,2024-01-29,Romania,795,"I was hoping for something better, but this item is completely useless.",11/13/2023,0.0,Neutral,2015.9,1,Mid,Neutral,5705.4400000000005,3,49,12,Champions,2023-12,2024-01,1,0
796,168,Patricia Taylor,242,Smartphone,Electronics,5,999.44,2023-09-26,Mauritania,796,Works perfectly! Totally exceeded my expectations in terms of performance.,2/28/2024,0.0,Neutral,4997.200000000001,9,Luxury,Neutral,9437.78,4,28,12,Champions,2023-09,2023-09,0,1
797,216,Nancy Goodwin,289,Heater,Home Appliances,5,612.96,2023-09-15,Sao Tome and Principe,797,"It works fine, but I had expected a bit more for the price.",6/13/2024,0.272222222,Positive,3064.8,9,Premium,M-Pos,6751.29,5,7,12,Champions,2023-09,2023-09,0,1
798,862,Erica Hurst,264,Refrigerator,Home Appliances,4,73.2,2024-03-16,Jamaica,798,I'm very unhappy with this purchase. It didn't meet my expectations.,11/30/2023,-0.78,Negative,292.8,3,Budget,S-Neg,625.72,2,101,8,Loyal,2023-10,2024-03,5,0
799,383,Jake Chavez,264,Toaster,Home Appliances,3,268.54,2024-01-16,Switzerland,799,"It works, but I've had better products for the same price.",9/10/2023,0.25,Positive,805.6200000000001,1,Mid,M-Pos,4577.7,2,161,9,Loyal,2023-10,2024-01,3,0
800,225,Joseph Bryan,237,Vacuum Cleaner,Home Appliances,2,522.12,2023-12-18,Nicaragua,800,"The product functions well, but I feel it could be improved in some areas.",12/11/2023,0.0,Neutral,1044.24,12,Premium,Neutral,3316.92,2,190,8,Loyal,2023-11,2023-12,1,1
801,476,Theresa Lamb,208,Smartphone,Electronics,5,410.06,2023-09-07,Uganda,801,"I can't say it's amazing, but it does what I need it to do.",10/25/2023,0.6,Positive,2050.3,9,Mid,S-Pos,4268.540000000001,4,26,12,Champions,2023-09,2023-09,0,1
802,568,James White,209,Microwave,Home Appliances,1,658.85,2023-08-07,Chad,802,This product is a game-changer. I'm so glad I bought it.,6/18/2024,0.5,Positive,658.85,8,Premium,M-Pos,957.0500000000001,2,322,6,Potential,2023-08,2023-08,0,0
803,382,Charles Hernandez,226,Washing Machine,Home Appliances,4,410.55,2024-01-14,Zambia,803,I absolutely love this product! It exceeded my expectations in every way.,11/1/2023,0.625,Positive,1642.2,1,Mid,S-Pos,2353.1400000000003,2,51,10,Champions,2024-01,2024-01,0,0
804,742,Jason Fleming,216,Smart Bulb,Electronics,5,817.85,2023-12-27,Guatemala,804,Wonderful product! The quality and performance are unmatched.,7/30/2023,1.0,Positive,4089.25,12,Luxury,S-Pos,6837.27,4,10,12,Champions,2023-12,2023-12,0,0
805,530,Matthew Carter,208,Vacuum Cleaner,Home Appliances,5,641.93,2023-07-04,Tunisia,805,So impressed by the quality. This product truly delivers.,9/13/2023,1.0,Positive,3209.6499999999996,7,Premium,S-Pos,3209.6499999999996,1,357,6,Potential,2023-07,2023-07,0,0
806,921,Travis Newman,252,Toaster,Home Appliances,5,307.19,2024-02-05,Guam,806,I couldn't be happier with my purchase. It's perfect for what I needed.,7/13/2023,1.0,Positive,1535.95,2,Mid,S-Pos,1535.95,1,141,7,Potential,2024-02,2024-02,0,1
807,771,Erin Watkins,289,Router,Electronics,2,300.85,2024-01-17,Tajikistan,807,"It's functional, but I'm not blown away by it.",4/20/2024,0.0,Neutral,601.7,1,Mid,Neutral,4276.58,2,132,11,Champions,2024-01,2024-01,0,1
808,661,Eric Anderson,239,Microwave,Home Appliances,3,727.93,2023-08-31,Somalia,808,The quality and performance of this product are top-notch.,10/13/2023,1.0,Positive,2183.79,8,Premium,S-Pos,6116.74,2,136,10,Champions,2023-08,2023-08,0,1
809,366,Jacob Roberts,206,Camera,Electronics,1,230.03,2023-08-22,Guinea,809,It's sufficient for basic needs but could be better.,12/8/2023,0.25,Positive,230.03,8,Budget,M-Pos,230.03,1,308,3,Lost,2023-08,2023-08,0,0
810,391,Christopher Glass,291,Smartwatch,Electronics,4,790.21,2024-01-19,France,810,The product arrived damaged and the customer service was terrible.,4/7/2024,-1.0,Negative,3160.84,1,Luxury,S-Neg,3160.84,1,158,6,Potential,2024-01,2024-01,0,0
811,286,Sara Schwartz,285,Toaster,Home Appliances,3,589.71,2024-04-29,Cape Verde,811,"Fantastic quality, and the performance is just amazing. Highly recommend!",6/18/2024,0.4,Positive,1769.13,4,Premium,M-Pos,2143.83,2,57,10,Champions,2023-10,2024-04,6,1
812,265,Andrew Stewart,216,Refrigerator,Home Appliances,4,63.14,2023-12-14,Eritrea,812,Top-notch customer service and a reliable product. Great job!,11/25/2023,1.0,Positive,252.56,12,Budget,S-Pos,2068.74,3,178,9,Loyal,2023-12,2023-12,0,1
813,478,Justin Johnson,240,Tablet,Electronics,2,505.47,2023-11-06,Cameroon,813,"Nothing to complain about, but nothing extraordinary either.",11/2/2023,0.333333333,Positive,1010.94,11,Premium,M-Pos,1010.94,1,232,5,At Risk,2023-11,2023-11,0,0
814,481,William Ferguson,215,Heater,Home Appliances,3,418.98,2024-06-17,Anguilla,814,"It's an okay product, but there are some issues I have with it.",10/7/2023,0.5,Positive,1256.94,6,Mid,M-Pos,1256.94,1,8,7,Potential,2024-06,2024-06,0,1
815,514,Patricia Gould,240,Headphones,Electronics,2,349.24,2023-08-25,Albania,815,I don't recommend this at all. It's not functional and doesn't last.,7/17/2023,0.0,Neutral,698.48,8,Mid,Neutral,698.48,1,305,3,Lost,2023-08,2023-08,0,1
816,856,Katie Holland,237,Microwave,Home Appliances,3,863.77,2023-12-27,Ukraine,816,This is exactly what I was looking for. I'm so glad I bought it!,8/13/2023,0.4375,Positive,2591.31,12,Luxury,M-Pos,2591.31,1,181,7,Potential,2023-12,2023-12,0,0
817,396,Nicole Mcknight,285,Laptop,Electronics,4,339.3,2023-08-22,South Georgia and the South Sandwich Islands,817,"Not bad, but there's room for improvement in some areas.",12/20/2023,0.35,Positive,1357.2,8,Mid,M-Pos,2866.4,2,49,10,Champions,2023-08,2023-08,0,0
818,678,Tammy Morgan,214,Camera,Electronics,1,14.67,2024-04-05,Lesotho,818,I regret buying this. The product is ineffective and badly made.,9/11/2023,-0.7,Negative,14.67,4,Budget,S-Neg,474.95,2,81,7,Potential,2024-03,2024-04,1,0
819,141,Juan Parker,251,Vacuum Cleaner,Home Appliances,2,580.52,2024-02-20,Tajikistan,819,"It works fine for now, but I'm not sure about its long-term durability.",2/4/2024,0.083333333,Positive,1161.04,2,Premium,Neutral,1645.24,3,126,9,Loyal,2023-09,2024-02,5,0
820,325,Brandon Brown,282,Tablet,Electronics,1,138.11,2023-09-09,Mozambique,820,"It's functional, but it's not a must-have product.",10/7/2023,0.0,Neutral,138.11,9,Budget,Neutral,978.79,2,165,7,Potential,2023-09,2023-09,0,0
821,639,Timothy Ramirez,202,Coffee Maker,Home Appliances,4,434.74,2023-07-28,Martinique,821,"I've been using this for a few weeks now, and it works flawlessly.",6/12/2024,0.4,Positive,1738.96,7,Mid,M-Pos,1738.96,1,333,5,At Risk,2023-07,2023-07,0,1
822,969,Michael Miller,265,Coffee Maker,Home Appliances,1,47.35,2023-11-26,Congo,822,"I thought this would be better, but it turned out to be a huge disappointment.",1/10/2024,0.1,Positive,47.35,11,Budget,Neutral,2032.01,2,78,10,Champions,2023-11,2023-11,0,0
823,602,Larry Harding,285,Camera,Electronics,1,893.09,2023-11-13,Indonesia,823,I absolutely love this product! It exceeded my expectations in every way.,2/11/2024,0.625,Positive,893.09,11,Luxury,S-Pos,3225.02,3,147,10,Champions,2023-09,2023-11,2,0
824,251,Jessica Hughes,201,Smartphone,Electronics,1,630.42,2023-10-14,Guatemala,824,The quality is outstanding. I'm extremely impressed.,10/25/2023,0.75,Positive,630.42,10,Premium,S-Pos,966.81,2,31,9,Loyal,2023-10,2023-10,0,0
825,459,Jeremy Hoffman,227,Television,Electronics,3,318.97,2024-04-03,Tuvalu,825,"Not good at all. The quality is very poor, and I'm disappointed.",11/17/2023,-0.54,Negative,956.9100000000001,4,Mid,S-Neg,1027.13,2,83,8,Loyal,2024-02,2024-04,2,0
826,554,Jennifer Ramos,220,Printer,Electronics,5,592.78,2024-05-03,Saint Lucia,826,"Great design, easy to use, and it works wonderfully. Highly recommend!",4/13/2024,0.477777778,Positive,2963.8999999999996,5,Premium,M-Pos,7173.7,3,53,12,Champions,2023-08,2024-05,9,1
827,534,Jennifer Houston,276,Laptop,Electronics,1,305.22,2023-07-29,Cambodia,827,"Excellent quality, great design, and super easy to use.",7/8/2023,0.641666667,Positive,305.22,7,Mid,S-Pos,5595.32,3,64,12,Champions,2023-07,2023-07,0,0
828,312,William Fox,242,Air Conditioner,Home Appliances,5,600.41,2023-07-21,Venezuela,828,"I've used it a few times and it works, but it's not impressive.",6/11/2024,-0.35,Negative,3002.0499999999997,7,Premium,M-Neg,3002.0499999999997,1,340,5,At Risk,2023-07,2023-07,0,0
829,704,Ann Ortiz,234,Coffee Maker,Home Appliances,2,349.31,2023-12-03,China,829,"The customer service was fantastic, and the product arrived on time.",12/6/2023,0.4,Positive,698.62,12,Mid,M-Pos,1449.56,3,205,8,Loyal,2023-10,2023-12,2,1
830,669,Keith Melendez,225,Toaster,Home Appliances,2,173.23,2023-09-06,Syrian Arab Republic,830,This is hands down the best purchase I've made this year.,9/9/2023,0.422222222,Positive,346.46,9,Budget,M-Pos,346.46,1,293,4,At Risk,2023-09,2023-09,0,0
